{
  "_metadata": {
    "dominio": "seleccion_reemplazo_motores_asincronicos",
    "subdominio": "capa_localizacion_causa_operacion_arranque",
    "norma": "IEC 60034-1 / NEMA MG-1 / Apuntes UNSJ Estimador 1-5",
    "descripcion": "Capa de localizacion: causa raiz del lado de la operacion (ciclos termicos abusivos del rotor, ambiente humedo de la aplicacion) y del esquema de arranque (estrella-triangulo inadecuado para carga pesada, problemas inducidos por VFD). Incluye tambien las dos causas residuales intrinsecas al motor: fin de vida util y defecto de fabricacion",
    "version": "1.0",
    "fuente": "Apunte de catedra UNSJ 'Sistema Experto de Seleccion de Reemplazo de Motores Asincronos' (Rodrigo 2026), Parte II, Secciones 6.3-6.5"
  },
  "variables": [
    {
      "name": "H_ARR_REP",
      "type": "boolean",
      "domain": [true, false],
      "value": [false],
      "section": "predicados_derivados",
      "description": "Hipotesis de arranques repetidos (entrada desde 02_signatura_rotor)"
    },
    {
      "name": "H_HUMEDAD",
      "type": "boolean",
      "domain": [true, false],
      "value": [false],
      "section": "predicados_derivados",
      "description": "Hipotesis de falla a tierra por humedad (entrada desde 01_signatura_estator)"
    },
    {
      "name": "H_ROD_EDM",
      "type": "boolean",
      "domain": [true, false],
      "value": [false],
      "section": "predicados_derivados",
      "description": "Hipotesis de falla de rodamiento por corrientes de eje (entrada desde 03_signatura_rodamientos)"
    },
    {
      "name": "H_SOBRET_TRANS",
      "type": "boolean",
      "domain": [true, false],
      "value": [false],
      "section": "predicados_derivados",
      "description": "Hipotesis de sobretension transitoria (entrada desde 01_signatura_estator)"
    },
    {
      "name": "H_ROD_LUB",
      "type": "boolean",
      "domain": [true, false],
      "value": [false],
      "section": "predicados_derivados",
      "description": "Hipotesis de falla de rodamiento por lubricacion (entrada desde 03_signatura_rodamientos)"
    },
    {
      "name": "BETA_VFD",
      "type": "boolean",
      "domain": [true, false],
      "value": [false],
      "section": "predicados_derivados",
      "description": "El motor es accionado por VFD (entrada desde 03_signatura_rodamientos)"
    },
    {
      "name": "MU_Y_ARR",
      "type": "numeric",
      "domain": [0.0, 5.0],
      "value": [1.0, 1.5],
      "section": "predicados_derivados",
      "description": "Margen efectivo de par en arranque estrella-triangulo: (1/3) * T_arr/T_n del motor / (T_arr_L / T_n) de la carga. Si < 1, el motor no logra acelerar en estrella y se sobrecalienta al conmutar"
    },
    {
      "name": "TARR_Y_DELTA",
      "type": "boolean",
      "domain": [true, false],
      "value": [false],
      "section": "predicados_derivados",
      "description": "Metodo de arranque actual es estrella-triangulo (Y-Delta)"
    },
    {
      "name": "APL_BOMBA_SUMERG_O_MQH",
      "type": "boolean",
      "domain": [true, false],
      "value": [false],
      "section": "predicados_derivados",
      "description": "Aplicacion expuesta a humedad: bomba sumergible o maquina herramienta con refrigeracion liquida"
    },
    {
      "name": "E_SERV_ANIOS",
      "type": "numeric",
      "domain": [0.0, 50.0],
      "value": [5.0, 10.0],
      "section": "predicados_derivados",
      "description": "Edad de servicio del motor fallado, en anios"
    },
    {
      "name": "N_REB_PREVIOS",
      "type": "numeric",
      "domain": [0.0, 10.0],
      "value": [0.0, 0.0],
      "section": "predicados_derivados",
      "description": "Numero de rebobinados previos sobre el mismo motor"
    },
    {
      "name": "C_OP_CICLOS_ROTOR",
      "type": "boolean",
      "domain": [true, false],
      "value": [false],
      "section": "causas_raiz",
      "description": "Causa raiz operacional: ciclos termicos del rotor por arranques mas frecuentes que el limite admisible"
    },
    {
      "name": "C_OP_HUMEDAD",
      "type": "boolean",
      "domain": [true, false],
      "value": [false],
      "section": "causas_raiz",
      "description": "Causa raiz operacional: ambiente humedo de la aplicacion (bomba sumergible mal sellada, maquina herramienta con fugas de refrigerante)"
    },
    {
      "name": "C_ARR_Y_DELTA_INAD",
      "type": "boolean",
      "domain": [true, false],
      "value": [false],
      "section": "causas_raiz",
      "description": "Causa raiz: metodo de arranque estrella-triangulo inadecuado para la carga (par insuficiente en estrella, conmutacion a baja velocidad genera transitorio destructivo)"
    },
    {
      "name": "C_ARR_VFD_MAL",
      "type": "boolean",
      "domain": [true, false],
      "value": [false],
      "section": "causas_raiz",
      "description": "Causa raiz: VFD mal aplicado o sin proteccion (sin filtro dV/dt, sin anillo de descarga, sin rampa adecuada): produce EDM o picos de tension"
    },
    {
      "name": "C_MOTOR_VIDA_UTIL",
      "type": "boolean",
      "domain": [true, false],
      "value": [false],
      "section": "causas_raiz",
      "description": "Causa intrinseca al motor: fin de vida util (motor con > 8 anios de servicio Y al menos un rebobinado previo presenta dano de rodamiento como agotamiento natural)"
    },
    {
      "name": "C_MOTOR_DEFECTO_FAB",
      "type": "boolean",
      "domain": [true, false],
      "value": [false],
      "section": "causas_raiz",
      "description": "Causa intrinseca al motor: defecto de fabricacion (motor con < 2 anios y sin rebobinados previos que falla por humedad o rodamiento implica defecto residual de planta)"
    }
  ],
  "expressions": [
    {
      "constraints": [
        "H_ARR_REP AND C_OP_CICLOS_ROTOR"
      ],
      "_group": "reglas_causa_raiz",
      "description": "C_OP_CICLOS_ROTOR <= H_ARR_REP (Apunte 4, ec. 34)"
    },
    {
      "constraints": [
        "H_HUMEDAD AND APL_BOMBA_SUMERG_O_MQH AND C_OP_HUMEDAD"
      ],
      "_group": "reglas_causa_raiz",
      "description": "C_OP_HUMEDAD <= H_HUMEDAD AND aplicacion expuesta a humedad (Apunte 4, ec. 35)"
    },
    {
      "constraints": [
        "H_ARR_REP AND TARR_Y_DELTA AND MU_Y_ARR < 1.0 AND C_ARR_Y_DELTA_INAD"
      ],
      "_group": "reglas_causa_raiz",
      "description": "C_ARR_Y_DELTA_INAD <= H_ARR_REP AND metodo Y-Delta AND margen efectivo en estrella < 1 (Apunte 4, ec. 36 + ec. 7)"
    },
    {
      "constraints": [
        "(H_ROD_EDM OR H_SOBRET_TRANS) AND BETA_VFD AND C_ARR_VFD_MAL"
      ],
      "_group": "reglas_causa_raiz",
      "description": "C_ARR_VFD_MAL <= (H_ROD_EDM OR H_SOBRET_TRANS) AND motor con VFD (Apunte 4, ec. 37)"
    },
    {
      "constraints": [
        "H_ROD_LUB AND NOT BETA_VFD AND E_SERV_ANIOS > 8.0 AND N_REB_PREVIOS >= 1.0 AND C_MOTOR_VIDA_UTIL"
      ],
      "_group": "reglas_causa_raiz",
      "description": "C_MOTOR_VIDA_UTIL <= H_ROD_LUB AND no VFD AND edad > 8 anios AND >= 1 rebobinado (Apunte 4, ec. 38: residual intrinseco)"
    },
    {
      "constraints": [
        "(H_ROD_LUB OR H_HUMEDAD) AND E_SERV_ANIOS < 2.0 AND N_REB_PREVIOS = 0.0 AND C_MOTOR_DEFECTO_FAB"
      ],
      "_group": "reglas_causa_raiz",
      "description": "C_MOTOR_DEFECTO_FAB <= (H_ROD_LUB OR H_HUMEDAD) AND edad < 2 anios AND 0 rebobinados (Apunte 4, ec. 39: residual intrinseco joven)"
    },
    {
      "constraints": [
        "MU_Y_ARR IN [0.0, 5.0] AND E_SERV_ANIOS IN [0.0, 50.0] AND N_REB_PREVIOS IN [0.0, 10.0]"
      ],
      "_group": "validacion_dominios",
      "description": "Constraints de dominio para variables numericas"
    }
  ],
  "functions": []
}
